{
  "id": "claude-ai",
  "name": "Claude AI",
  "summary": "AI assistant integration via Slack, PR comments, and Claude Code CLI for autonomous coding tasks.",
  "category": "ai",
  "type": "connectable",
  "capabilities": ["chat", "pr-agent", "code-generation", "issue-resolution"],
  "install": {
    "provisioner": "scripts/provisioners/install_claude.sh",
    "scopes": [],
    "env_vars": ["ANTHROPIC_API_KEY"],
    "auto_configure": false
  },
  "links": {
    "docs": "https://docs.anthropic.com/",
    "vendor": "https://anthropic.com"
  },
  "status": "active"
}
